{
  "schemaVersion": 1,
  "kind": "resolve.aidlc",
  "requirementsContext": {
    "screens": [
      "Confirm payment"
    ],
    "assumptions": [],
    "openQuestions": [
      "Confirm payment: Part Avatar [ACMEUI 30:40] (inside Payee picker) has no code link. Stop and ask."
    ]
  },
  "designHandoff": {
    "draft": false,
    "codeMap": true,
    "screens": [
      {
        "name": "Confirm payment",
        "fileKey": "ACMEUI",
        "figmaNodeId": "20:20",
        "parts": [
          {
            "name": "Payee picker",
            "fileKey": "ACMEUI",
            "figmaNodeId": "30:30",
            "count": 1,
            "identity": "confirmed",
            "status": "current",
            "codeStatus": "mapped",
            "code": "AcmePayeePickerComponent from '@acme/payments-angular'",
            "angular": {
              "selector": "acme-payee-picker",
              "importPath": "@acme/payments-angular",
              "standalone": true
            }
          },
          {
            "name": "Button",
            "variant": "Variant=Danger, Size=Medium",
            "fileKey": "ACMEUI",
            "figmaNodeId": "30:14",
            "count": 1,
            "identity": "confirmed",
            "status": "current",
            "codeStatus": "mapped",
            "code": "AcmeButtonComponent from '@acme/ui-angular'",
            "angular": {
              "selector": "acme-button",
              "importPath": "@acme/ui-angular",
              "module": "AcmeButtonModule"
            },
            "states": {
              "Variant": [
                "Primary",
                "Secondary"
              ],
              "Size": [
                "Large"
              ]
            }
          }
        ],
        "verify": {
          "pass": true,
          "retired": [],
          "unresolved": []
        },
        "openItems": [
          "Part Avatar [ACMEUI 30:40] (inside Payee picker) has no code link. Stop and ask."
        ]
      }
    ],
    "decisions": {
      "recorded": true,
      "picks": [
        {
          "name": "Payee picker",
          "fileKey": "ACMEUI",
          "figmaNodeId": "30:30",
          "source": "placed",
          "match": "placed",
          "why": "Code: AcmePayeePickerComponent from '@acme/payments-angular'",
          "screen": "Confirm payment"
        },
        {
          "name": "Button",
          "fileKey": "ACMEUI",
          "figmaNodeId": "30:14",
          "source": "placed",
          "match": "placed",
          "why": "Code: AcmeButtonComponent from '@acme/ui-angular'",
          "screen": "Confirm payment"
        }
      ],
      "rejected": []
    }
  }
}
